{
  "document_id": "45/2019/QH14",
  "domain": "Labor",
  "type": "Law",
  "issuer": "Quốc hội (National Assembly)",
  "issue_date": "2019-11-20",
  "effective_date": "2021-01-01",
  "expiration_date": null,
  "status": "Active",
  "official_url": "https://vbpl.vn/TW/Pages/vbpq-toanvan.aspx?ItemID=139264",
  "tags": ["employment", "wage", "working hours", "contract"]
}
